{
  "schema_version": "1.0",
  "record_id": "expert-example-0001",
  "proposal_group": "proposal-example-0001",
  "proposal_version_id": "proposal-version-example-0001-v1",
  "document_sha256": "replace-with-64-character-document-sha256-before-training",
  "scheme_code": "MOC-ST",
  "guideline_version": "2.0",
  "rubric_version": "2.0",
  "institution_id_hash": "replace-with-pseudonymous-institution-hash",
  "proposal_year": 2026,
  "language": "en",
  "ocr_used": false,
  "label_origin": "expert adjudication",
  "reviewer_count": 2,
  "inter_reviewer_agreement": 0.82,
  "criterion_scores": {
    "uniqueness-vs-past-work": 6.0,
    "patent-ip-potential": 3.0,
    "indigenisation-potential": 3.0,
    "technical-clarity": 3.0,
    "trl-advancement": 5.2,
    "infrastructure-readiness": 3.8,
    "team-track-record": 3.8,
    "workplan-milestones": 2.2,
    "adoption-likelihood": 7.5,
    "economic-benefit-ratio": 4.5,
    "safety-environment-impact": 3.8,
    "strategic-fit": 3.0,
    "sc-st-participation": 2.2,
    "women-researchers": 2.2,
    "startup-rural-innovators": 1.5,
    "multi-agency-collaboration": 1.5,
    "budget-realism": 4.5,
    "phased-funding": 2.2,
    "roi-realism": 3.0,
    "manpower-cost-ratio": 1.5,
    "dependencies-listed": 2.2,
    "mitigation-plans": 3.0,
    "compliance-readiness": 2.2
  },
  "criterion_evidence": {
    "uniqueness-vs-past-work": "Expert-supported evidence excerpt for uniqueness versus past work from the immutable proposal version.",
    "patent-ip-potential": "Expert-supported evidence excerpt for patent and ip potential from the immutable proposal version.",
    "indigenisation-potential": "Expert-supported evidence excerpt for indigenisation and import substitution from the immutable proposal version.",
    "technical-clarity": "Expert-supported evidence excerpt for technical clarity from the immutable proposal version.",
    "trl-advancement": "Expert-supported evidence excerpt for technology readiness advancement from the immutable proposal version.",
    "infrastructure-readiness": "Expert-supported evidence excerpt for infrastructure readiness from the immutable proposal version.",
    "team-track-record": "Expert-supported evidence excerpt for team track record from the immutable proposal version.",
    "workplan-milestones": "Expert-supported evidence excerpt for work plan and milestones from the immutable proposal version.",
    "adoption-likelihood": "Expert-supported evidence excerpt for adoption likelihood from the immutable proposal version.",
    "economic-benefit-ratio": "Expert-supported evidence excerpt for economic benefit ratio from the immutable proposal version.",
    "safety-environment-impact": "Expert-supported evidence excerpt for safety and environmental impact from the immutable proposal version.",
    "strategic-fit": "Expert-supported evidence excerpt for strategic fit from the immutable proposal version.",
    "sc-st-participation": "Expert-supported evidence excerpt for sc/st participation from the immutable proposal version.",
    "women-researchers": "Expert-supported evidence excerpt for women researchers from the immutable proposal version.",
    "startup-rural-innovators": "Expert-supported evidence excerpt for startup and rural innovators from the immutable proposal version.",
    "multi-agency-collaboration": "Expert-supported evidence excerpt for multi-agency collaboration from the immutable proposal version.",
    "budget-realism": "Expert-supported evidence excerpt for budget realism from the immutable proposal version.",
    "phased-funding": "Expert-supported evidence excerpt for phased funding from the immutable proposal version.",
    "roi-realism": "Expert-supported evidence excerpt for roi realism from the immutable proposal version.",
    "manpower-cost-ratio": "Expert-supported evidence excerpt for manpower cost ratio from the immutable proposal version.",
    "dependencies-listed": "Expert-supported evidence excerpt for dependencies listed from the immutable proposal version.",
    "mitigation-plans": "Expert-supported evidence excerpt for mitigation plans from the immutable proposal version.",
    "compliance-readiness": "Expert-supported evidence excerpt for compliance readiness from the immutable proposal version."
  },
  "adjudication_rationale": "Two qualified reviewers resolved score differences against the approved annotation rulebook.",
  "text": "Replace this example with the complete lawfully processed proposal text or an approved de-identified representation. Do not use the placeholder record for production training."
}
